{
  "normalized_event": {
    "event_id": "evt-2026-0720-000512",
    "normalization_version": "v1",
    "tenant_id": "CLI-002",
    "agent_id": "011",
    "asset_id": "AST-011",
    "timestamp": "2026-07-20T09:00:00-05:00",
    "source": "wazuh_vulnerability_detector",
    "case_type": "VULNERABILITY",
    "rule_id": "23506",
    "rule_level": 13,
    "rule_groups": ["vulnerability-detector"],
    "cve": "CVE-2026-60137",
    "raw_event_reference": "indexer://alerts/2026.07.20/evt-2026-0720-000512",
    "enrichment_pending": ["cisa_kev"]
  },
  "enrichment_result": {
    "ioc_type": "cve",
    "ioc_value": "CVE-2026-60137",
    "enrichment_type": "cisa_kev",
    "queried_at": "2026-07-21T06:00:00-05:00",
    "cache_ttl_seconds": 86400,
    "source_provider": "cisa-kev-local-copy",
    "result": {},
    "kev_result": {
      "kev_status": "listed",
      "is_known_exploited": true,
      "cve_id": "CVE-2026-60137",
      "catalog_version": "2026.07.21",
      "catalog_fetched_at": "2026-07-21T05:00:00-05:00",
      "vendor_project": "WordPress",
      "product": "Core",
      "vulnerability_name": "WordPress Core SQL Injection Vulnerability",
      "date_added": "2026-07-21",
      "short_description": "WordPress Core contains a SQL injection vulnerability when a plugin or theme passes untrusted input to the parameter. This vulnerability can be chained with CVE-2026-63030 to allow an unauthenticated attacker to gain remote code execution on default WordPress installations.",
      "required_action": "Apply mitigations in accordance with vendor instructions...",
      "due_date": "2026-08-04",
      "known_ransomware_campaign_use": "Unknown",
      "cwes": ["CWE-89"],
      "notes": "https://wordpress.org/news/2026/07/wordpress-7-0-2-release/"
    },
    "confidence": null,
    "query_failed": false
  },
  "asset_context": {
    "tenant_id": "CLI-002",
    "asset_id": "AST-011",
    "asset_alias": "Sitio web corporativo",
    "hostname": "web-corp-01.cli002.local",
    "environment_type": "production",
    "site_type": "cloud",
    "criticality": "high",
    "business_service": "Sitio web y blog corporativo (WordPress)",
    "internet_exposed": true,
    "owner_name": "Proveedor de TI externo del cliente",
    "owner_contact": null,
    "operating_system": "Linux (WordPress)",
    "asset_status": "active",
    "context_updated_at": "2026-05-01T00:00:00-05:00"
  },
  "risk_result": {
    "case_id": "KRP-2026-000512",
    "risk_score": null,
    "priority_level": "critico",
    "risk_factors": [
      { "factor": "known_exploitation", "value": true, "weight": null, "explanation": "enrichment_result.kev_result.kev_status='listed' -- CVE-2026-60137 está en el catálogo CISA KEV (dateAdded 2026-07-21)" },
      { "factor": "asset_exposure", "value": true, "weight": null, "explanation": "asset_context.internet_exposed=true (sitio web público)" },
      { "factor": "asset_criticality", "value": "high", "weight": null, "explanation": "asset_context.criticality=high" }
    ],
    "risk_policy_version": "VULNERABILITY@DISEÑADO",
    "calculated_at": "2026-07-21T06:00:05-05:00",
    "input_references": ["enrichment_result:CVE-2026-60137", "asset_context:AST-011"]
  },
  "procedure": {
    "procedure_id": "PROC-VULN-001",
    "procedure_version": "1",
    "title": "Vulnerabilidad detectada (genérica o KEV) -- respuesta autorizada",
    "owner": "Kriptome SOC Lead",
    "case_type": "VULNERABILITY",
    "priority_levels": ["critico"],
    "customer_actions": [
      "Coordinar con su proveedor de TI o desarrollador la actualización de WordPress a la versión que corrige esta falla",
      "Confirmar con su proveedor cuándo se aplicará la actualización"
    ],
    "internal_actions": ["monitorear el activo con mayor sensibilidad mientras la vulnerabilidad siga activa"],
    "do_not_do": [],
    "decision_points": {
      "vulnerability_classification": {
        "description": "Clasificación actual del caso (generic/kev/ransomware_related/unsupported_product).",
        "kev": ["notificar con prioridad crítica, sin esperar al digest", "fijar un plazo recomendado propio, no copiar dueDate de CISA literalmente"]
      }
    },
    "evidence_to_preserve": [],
    "recommended_deadline": "PT72H",
    "human_review_required": true,
    "out_of_band_confirmation_required": false,
    "approved_by": null,
    "approved_at": null,
    "status": "draft"
  }
}
